{
  "format": "openbindings.transform-numerical-scenarios@1",
  "rule": "OBI-T-10",
  "capacity": [
    {"id":"cap-binary64","radix":2,"precision":53,"minimumPositive":"binary64-min-positive","maximumFinite":"binary64-max-finite","underflowStep":"binary64-min-positive","rounding":"nearest-ties-even","eligible":true},
    {"id":"cap-decimal17","radix":10,"precision":17,"minimumPositive":"1e-400","maximumFinite":"1e400","underflowStep":"1e-400","rounding":"nearest-ties-even","eligible":true},
    {"id":"cap-decimal34","radix":10,"precision":34,"minimumPositive":"1e-400","maximumFinite":"1e400","underflowStep":"1e-400","rounding":"nearest-ties-even","eligible":true},
    {"id":"cap-binary113","radix":2,"precision":113,"minimumPositive":"1e-400","maximumFinite":"1e400","underflowStep":"1e-400","rounding":"nearest-ties-even","eligible":true},
    {"id":"cap-binary32-rejected","radix":2,"precision":24,"minimumPositive":"1e-400","maximumFinite":"1e400","underflowStep":"1e-400","rounding":"nearest-ties-even","eligible":false},
    {"id":"cap-decimal16-rejected","radix":10,"precision":16,"minimumPositive":"1e-400","maximumFinite":"1e400","underflowStep":"1e-400","rounding":"nearest-ties-even","eligible":false},
    {"id":"cap-range-rejected","radix":10,"precision":34,"minimumPositive":"1e-400","maximumFinite":"1e300","underflowStep":"1e-400","rounding":"nearest-ties-even","eligible":false},
    {"id":"cap-small-range-rejected","radix":10,"precision":34,"minimumPositive":"1e-300","maximumFinite":"1e400","underflowStep":"1e-300","rounding":"nearest-ties-even","eligible":false},
    {"id":"cap-flush-subnormals-rejected","radix":2,"precision":53,"minimumPositive":"binary64-min-positive","maximumFinite":"binary64-max-finite","underflowStep":"1e-308","rounding":"nearest-ties-even","eligible":false},
    {"id":"cap-rounding-rejected","radix":10,"precision":34,"minimumPositive":"1e-400","maximumFinite":"1e400","underflowStep":"1e-400","rounding":"toward-zero","eligible":false}
  ],
  "cases": [
    {"id":"numeric-small-add","expr":"2+2","inputJSON":"{}","syntaxValid":true,"reference":{"status":"json","json":"4"},"exact34":{"status":"json","json":"4"}},
    {"id":"numeric-overflow-product","expr":"1e308*1e308","inputJSON":"{}","syntaxValid":true,"reference":{"status":"failure"},"exact34":{"status":"json","json":"1e616"}},
    {"id":"numeric-adjacent-literals","expr":"9007199254740992=9007199254740993","inputJSON":"{}","syntaxValid":true,"reference":{"status":"json","json":"true"},"exact34":{"status":"json","json":"false"}},
    {"id":"numeric-adjacent-inputs","expr":"a=b","inputJSON":"{\"a\":9007199254740992,\"b\":9007199254740993}","syntaxValid":true,"reference":{"status":"json","json":"true"},"exact34":{"status":"json","json":"false"}},
    {"id":"numeric-input-literal","expr":"n=9007199254740993","inputJSON":"{\"n\":9007199254740993}","syntaxValid":true,"reference":{"status":"json","json":"true"},"exact34":{"status":"json","json":"true"}},
    {"id":"numeric-constructor-literal","expr":"$number(\"9007199254740993\")=9007199254740993","inputJSON":"{}","syntaxValid":true,"reference":{"status":"json","json":"true"},"exact34":{"status":"json","json":"true"}},
    {"id":"numeric-branch","expr":"9007199254740992=9007199254740993 ? \"merged\" : \"distinct\"","inputJSON":"{}","syntaxValid":true,"reference":{"status":"json","json":"\"merged\""},"exact34":{"status":"json","json":"\"distinct\""}},
    {"id":"numeric-decimal-add","expr":"0.1+0.2","inputJSON":"{}","syntaxValid":true,"reference":{"status":"json","json":"0.30000000000000004"},"exact34":{"status":"json","json":"0.3"}},
    {"id":"numeric-computed-comparison","expr":"0.1+0.2=0.3","inputJSON":"{}","syntaxValid":true,"reference":{"status":"json","json":"false"},"exact34":{"status":"json","json":"true"}},
    {"id":"numeric-third-denotation","expr":"1/3=0.3333333333333333333333333333333333","inputJSON":"{}","syntaxValid":true,"reference":{"status":"json","json":"true"},"exact34":{"status":"json","json":"true"}},
    {"id":"numeric-third-not-hidden-rational","expr":"(1/3)*3=1","inputJSON":"{}","syntaxValid":true,"reference":{"status":"json","json":"true"},"exact34":{"status":"json","json":"false"}},
    {"id":"numeric-tiny-truth","expr":"$boolean(1e-400)","inputJSON":"{}","syntaxValid":true,"reference":{"status":"json","json":"false"},"exact34":{"status":"json","json":"true"}},
    {"id":"numeric-huge-literal","expr":"$type(1e400)","inputJSON":"{}","syntaxValid":true,"reference":{"status":"failure"},"exact34":{"status":"json","json":"\"number\""}},
    {"id":"numeric-huge-constructor","expr":"$type($number(\"1e400\"))","inputJSON":"{}","syntaxValid":true,"reference":{"status":"failure"},"exact34":{"status":"json","json":"\"number\""}},
    {"id":"numeric-eval-range","expr":"$eval(\"$type(1e400)\")","inputJSON":"{}","syntaxValid":true,"reference":{"status":"failure"},"exact34":{"status":"json","json":"\"number\""}},
    {"id":"numeric-distinct","expr":"$count($distinct([9007199254740992,9007199254740993]))","inputJSON":"{}","syntaxValid":true,"reference":{"status":"json","json":"1"},"exact34":{"status":"json","json":"2"}},
    {"id":"numeric-membership","expr":"9007199254740993 in [9007199254740992]","inputJSON":"{}","syntaxValid":true,"reference":{"status":"json","json":"true"},"exact34":{"status":"json","json":"false"}},
    {"id":"numeric-deep-equality","expr":"{\"n\":9007199254740992}={\"n\":9007199254740993}","inputJSON":"{}","syntaxValid":true,"reference":{"status":"json","json":"true"},"exact34":{"status":"json","json":"false"}},
    {"id":"numeric-carrier-type","expr":"$type(n)","inputJSON":"{\"n\":9007199254740993}","syntaxValid":true,"reference":{"status":"json","json":"\"number\""},"exact34":{"status":"json","json":"\"number\""}},
    {"id":"numeric-type-coercion-forbidden","expr":"1=\"1\"","inputJSON":"{}","syntaxValid":true,"reference":{"status":"json","json":"false"},"exact34":{"status":"json","json":"false"}},
    {"id":"numeric-wrong-arithmetic-type","expr":"1+\"2\"","inputJSON":"{}","syntaxValid":true,"reference":{"status":"failure"},"exact34":{"status":"failure"}},
    {"id":"numeric-round-even","expr":"$round(2.5)","inputJSON":"{}","syntaxValid":true,"reference":{"status":"json","json":"2"},"exact34":{"status":"json","json":"2"}},
    {"id":"numeric-round-even-up","expr":"$round(3.5)","inputJSON":"{}","syntaxValid":true,"reference":{"status":"json","json":"4"},"exact34":{"status":"json","json":"4"}},
    {"id":"numeric-display-rule-retained","expr":"$string(0.10000000000000002)","inputJSON":"{}","syntaxValid":true,"reference":{"status":"json","json":"\"0.1\""},"exact34":{"status":"json","json":"\"0.1\""}},
    {"id":"numeric-explicit-array","expr":"[1]","inputJSON":"{}","syntaxValid":true,"reference":{"status":"json","json":"[1]"},"exact34":{"status":"json","json":"[1]"}},
    {"id":"numeric-null-result","expr":"null","inputJSON":"{}","syntaxValid":true,"reference":{"status":"json","json":"null"},"exact34":{"status":"json","json":"null"}},
    {"id":"numeric-undefined-fails","expr":"absent","inputJSON":"{}","syntaxValid":true,"reference":{"status":"failure"},"exact34":{"status":"failure"}},
    {"id":"numeric-function-result-fails","expr":"function($x){$x}","inputJSON":"{}","syntaxValid":true,"reference":{"status":"failure"},"exact34":{"status":"failure"}},
    {"id":"numeric-zero-division-fails","expr":"0/0","inputJSON":"{}","syntaxValid":true,"reference":{"status":"failure"},"exact34":{"status":"failure"}},
    {"id":"numeric-host-extension-forbidden","expr":"$hostSecret()","inputJSON":"{}","syntaxValid":true,"reference":{"status":"failure"},"exact34":{"status":"failure"}},
    {"id":"numeric-malformed-exponent","expr":"1e+","inputJSON":"{}","syntaxValid":false,"reference":{"status":"failure"},"exact34":{"status":"failure"}},
    {"id":"numeric-range-then-malformed","expr":"1e400 +","inputJSON":"{}","syntaxValid":false,"reference":{"status":"failure"},"exact34":{"status":"failure"}},
    {"id":"numeric-leading-zero-invalid","expr":"01","inputJSON":"{}","syntaxValid":false,"reference":{"status":"failure"},"exact34":{"status":"failure"}},
    {"id":"numeric-eval-malformed","expr":"$eval(\"1e400 +\")","inputJSON":"{}","syntaxValid":true,"reference":{"status":"failure"},"exact34":{"status":"failure"}}
  ]
}
